{
  "case_id": "TC07",
  "input": "昨日は強い雨だった。会議の飲み物は麦茶にしたい。\n本題だけど、チームの議事録をあとから探すのが大変なので改善したい。\n今はフォルダごとに名前の付け方が異なり、別部署の議事録もある。\n",
  "goals": [
    {
      "id": "G1",
      "statement": "チームの議事録を後から探しやすくしたい。",
      "status": "confirmed",
      "source": "cases/TC07.txt の明示記述"
    },
    {
      "id": "GA",
      "statement": "過去の決定や議論を業務で再利用したい可能性がある。",
      "status": "hypothesis",
      "source": "原文から推定した上位目的。依頼者未確認。"
    }
  ],
  "requirements": [
    {
      "id": "RP",
      "statement": "議事録の所在・命名と閲覧権限を調査し、検索または整理方法を比較する。",
      "status": "proposed",
      "kind": "business",
      "source": "分析者の提案。依頼者未承認。",
      "goal_ids": [
        "G1",
        "GA"
      ]
    }
  ],
  "hypotheses": [
    {
      "id": "H1",
      "statement": "フォルダ間の命名差で探索が難しいかもしれない。",
      "source": "分析者の原因・解決仮説。未検証。"
    },
    {
      "id": "H2",
      "statement": "議事録の内容や日付・会議名の記録不足が原因かもしれない。",
      "source": "分析者の原因・解決仮説。未検証。"
    },
    {
      "id": "H3",
      "statement": "別部署の文書への権限や所在確認に時間がかかるかもしれない。",
      "source": "分析者の原因・解決仮説。未検証。"
    }
  ],
  "unknowns": [
    {
      "id": "U1",
      "statement": "探す内容と失敗例",
      "impact": "命名・全文検索・運用の優先順位を選べない",
      "resolution": "代表的な検索作業を観察する。"
    },
    {
      "id": "U2",
      "statement": "別部署の議事録を含める範囲と権限",
      "impact": "安全な検索対象を定められない",
      "resolution": "文書管理者と公開範囲を確認する。"
    }
  ],
  "questions": [
    {
      "id": "Q1",
      "question": "どの会議の何を探せなかったか、実例はありますか？",
      "reason": "必要な検索軸と再現ケースを決める。",
      "priority": "high",
      "unknown_ids": [
        "U1"
      ]
    },
    {
      "id": "Q2",
      "question": "別部署の議事録は誰がどこまで閲覧してよいですか？",
      "reason": "対象範囲と閲覧制御を決める。",
      "priority": "high",
      "unknown_ids": [
        "U2"
      ]
    }
  ],
  "verification": [
    {
      "id": "V1",
      "claim": "表明された目的・制約の充足性と、提案・原因仮説の妥当性を調べる。",
      "method": "代表議事録の命名と記録項目を棚卸しし、実際の探索タスクで整理案と検索案の到達時間・成功率を比較する。",
      "metric": "目的議事録への到達率・時間、命名のばらつき、権限外の結果露出。",
      "decision_rule": "改善基準は未合意。現状計測後に対象範囲と成功条件を合意する。",
      "limitation": "命名統一だけで本文にない情報は見つからない。別部署の文書は調査許可が必要。",
      "related_ids": [
        "G1",
        "GA",
        "RP",
        "H1",
        "H2",
        "H3"
      ],
      "status": "planned"
    }
  ],
  "risks": [
    {
      "id": "K1",
      "description": "無関係な会話を要件に混ぜる、または部署境界を無視して情報を公開する。",
      "mitigation": "原因調査と関係者の合意を先に行い、基準を明示して試行結果を判断する。"
    }
  ],
  "warnings": [
    "雨と飲み物の話は原文にあるが、議事録改善の要件には含めない。命名差は事実だが失敗原因は未確認。",
    "業務検証は未実施。仮説の網羅性は保証しない。構造検証の成功は意味的妥当性の証明ではない。"
  ]
}
