{
  "case_id": "TC01",
  "input": "検索システムを使いやすくしたい。\n",
  "goals": [
    {
      "id": "G1",
      "statement": "検索システムを使いやすくしたい。",
      "status": "confirmed",
      "source": "cases/TC01.txt の明示記述"
    },
    {
      "id": "GA",
      "statement": "必要な情報を利用するまでの負担を減らすことが上位目的かもしれない。",
      "status": "hypothesis",
      "source": "原文から推定した上位目的。依頼者未確認。"
    }
  ],
  "requirements": [
    {
      "id": "RP",
      "statement": "代表タスクで現状と改善後の情報到達率と操作負担を比較する。",
      "status": "proposed",
      "kind": "business",
      "source": "分析者の提案。依頼者未承認。",
      "goal_ids": [
        "G1",
        "GA"
      ]
    }
  ],
  "hypotheses": [
    {
      "id": "H1",
      "statement": "入力や絞り込み、結果の読み取りが負担かもしれない。",
      "source": "分析者の原因・解決仮説。未検証。"
    },
    {
      "id": "H2",
      "statement": "検索語との表現差で関連文書を見落としているかもしれない。",
      "source": "分析者の原因・解決仮説。未検証。"
    },
    {
      "id": "H3",
      "statement": "必要情報の未登録や古さ、利用権限が障害かもしれない。",
      "source": "分析者の原因・解決仮説。未検証。"
    }
  ],
  "unknowns": [
    {
      "id": "U1",
      "statement": "利用者・対象製品・検索目的",
      "impact": "調査対象を選べない",
      "resolution": "依頼者に対象と代表タスクを確認する。"
    },
    {
      "id": "U2",
      "statement": "困った具体例と成功条件",
      "impact": "改善の優先順位と合否を決められない",
      "resolution": "実際の検索例を聞き、基準計測後に成功条件を合意する。"
    }
  ],
  "questions": [
    {
      "id": "Q1",
      "question": "誰がどのシステムで何を探しますか？",
      "reason": "代表タスクと調査対象を選ぶ。",
      "priority": "high",
      "unknown_ids": [
        "U1"
      ]
    },
    {
      "id": "Q2",
      "question": "直近の失敗例と期待結果は何ですか？",
      "reason": "操作、検索品質、情報不在を切り分ける。",
      "priority": "high",
      "unknown_ids": [
        "U2"
      ]
    },
    {
      "id": "Q3",
      "question": "何ができれば改善成功ですか？",
      "reason": "受け入れ条件を決める。",
      "priority": "high",
      "unknown_ids": [
        "U2"
      ]
    }
  ],
  "verification": [
    {
      "id": "V1",
      "claim": "表明された目的・制約の充足性と、提案・原因仮説の妥当性を調べる。",
      "method": "代表利用者の作業観察と、実検索語に対する人手関連性判定を行い、必要情報の存在と権限も調査する。",
      "metric": "情報到達率、完了時間、迷い・戻り操作、関連文書の取りこぼし。",
      "decision_rule": "成功基準は未確定。現状計測と依頼者の合意後に定める。",
      "limitation": "少数の作業例は全利用者を代表しない。関連性判定や観察には偏りがある。",
      "related_ids": [
        "G1",
        "GA",
        "RP",
        "H1",
        "H2",
        "H3"
      ],
      "status": "planned"
    }
  ],
  "risks": [
    {
      "id": "K1",
      "description": "検索品質だけを改善しても業務の負担が残る。",
      "mitigation": "原因調査と関係者の合意を先に行い、基準を明示して試行結果を判断する。"
    }
  ],
  "warnings": [
    "対象がmy-searchであるとは原文から判断できない。",
    "業務検証は未実施。仮説の網羅性は保証しない。構造検証の成功は意味的妥当性の証明ではない。"
  ]
}
