{
  "case_id": "TC09",
  "input": "社内文書を横断検索できるようにしたい。権限のない社員に文書内容を見せてはいけない。\n一方、監査担当は誰が機密文書にアクセスしたか追跡したい。\n検索ログの保存期間や監査権限の範囲は未定だ。\n",
  "goals": [
    {
      "id": "G1",
      "statement": "社内文書を横断検索したい。",
      "status": "confirmed",
      "source": "cases/TC09.txt の明示記述"
    },
    {
      "id": "G2",
      "statement": "権限外への内容開示を防ぎたい。",
      "status": "confirmed",
      "source": "cases/TC09.txt の明示記述"
    },
    {
      "id": "G3",
      "statement": "監査担当は機密文書へのアクセスを追跡したい。",
      "status": "confirmed",
      "source": "cases/TC09.txt の明示記述"
    },
    {
      "id": "GA",
      "statement": "必要情報の利用とアクセスの説明責任を両立したい可能性がある。",
      "status": "hypothesis",
      "source": "原文から推定した上位目的。依頼者未確認。"
    }
  ],
  "requirements": [
    {
      "id": "R1",
      "statement": "社内文書を横断検索する。",
      "status": "confirmed",
      "kind": "functional",
      "source": "cases/TC09.txt の明示記述",
      "goal_ids": [
        "G1",
        "G2",
        "G3"
      ]
    },
    {
      "id": "R2",
      "statement": "権限のない社員へ文書内容を見せない。",
      "status": "confirmed",
      "kind": "constraint",
      "source": "cases/TC09.txt の明示記述",
      "goal_ids": [
        "G1",
        "G2",
        "G3"
      ]
    },
    {
      "id": "R3",
      "statement": "誰が機密文書へアクセスしたか追跡する。",
      "status": "confirmed",
      "kind": "functional",
      "source": "cases/TC09.txt の明示記述",
      "goal_ids": [
        "G1",
        "G2",
        "G3"
      ]
    },
    {
      "id": "RP",
      "statement": "検索結果・抜粋・キャッシュを含む権限チェックと、範囲を限定した監査ログ閲覧を設計する。",
      "status": "proposed",
      "kind": "business",
      "source": "分析者の提案。依頼者未承認。",
      "goal_ids": [
        "G1",
        "GA"
      ]
    }
  ],
  "hypotheses": [
    {
      "id": "H1",
      "statement": "原本と索引の権限同期の遅れが漏洩を生むかもしれない。",
      "source": "分析者の原因・解決仮説。未検証。"
    },
    {
      "id": "H2",
      "statement": "抜粋や検索ログ経由で機密情報が露出するかもしれない。",
      "source": "分析者の原因・解決仮説。未検証。"
    },
    {
      "id": "H3",
      "statement": "共有アカウントやアクセス記録の定義不足で追跡できないかもしれない。",
      "source": "分析者の原因・解決仮説。未検証。"
    }
  ],
  "unknowns": [
    {
      "id": "U1",
      "statement": "ログ保存期間と監査権限が未定",
      "impact": "保持・削除・閲覧設計を確定できない",
      "resolution": "文書管理・監査責任者と利用目的と範囲を合意する。"
    },
    {
      "id": "U2",
      "statement": "アクセスの定義と既存権限モデル",
      "impact": "追跡対象と認可経路を確定できない",
      "resolution": "原本システムの仕様を調査しイベント定義を合意する。"
    }
  ],
  "questions": [
    {
      "id": "Q1",
      "question": "監査ログを誰が何の目的で、どの期間閲覧・保存しますか？",
      "reason": "監査範囲と保持・削除条件を決める。",
      "priority": "high",
      "unknown_ids": [
        "U1"
      ]
    },
    {
      "id": "Q2",
      "question": "アクセスは検索結果の表示、抜粋、閲覧、ダウンロードのどれを指しますか？",
      "reason": "記録イベントと漏洩試験の範囲を決める。",
      "priority": "high",
      "unknown_ids": [
        "U2"
      ]
    }
  ],
  "verification": [
    {
      "id": "V1",
      "claim": "表明された目的・制約の充足性と、提案・原因仮説の妥当性を調べる。",
      "method": "権限マトリクスで検索・抜粋・原本・キャッシュ・権限取消を試験し、既知のアクセスイベントと監査ログを照合する。",
      "metric": "権限外内容の露出件数、既知イベントの記録欠落・誤記、監査権限の逸脱、保持期限後の残存。",
      "decision_rule": "権限外の文書内容が見える事例は明示要求への違反。追跡範囲・保持期間・同期遅延の基準は未確定。",
      "limitation": "有限の権限組み合わせでは未知の経路を保証できない。法令や社内規程の適合は別途確認が必要。",
      "related_ids": [
        "G1",
        "G2",
        "G3",
        "GA",
        "R1",
        "R2",
        "R3",
        "RP",
        "H1",
        "H2",
        "H3"
      ],
      "status": "planned"
    }
  ],
  "risks": [
    {
      "id": "K1",
      "description": "検索権限を守ってもログや抜粋が漏洩経路になる。",
      "mitigation": "原因調査と関係者の合意を先に行い、基準を明示して試行結果を判断する。"
    }
  ],
  "warnings": [
    "監査担当に無制限の文書閲覧権限を与える要求はない。ログの期間や範囲を推定で確定しない。",
    "業務検証は未実施。仮説の網羅性は保証しない。構造検証の成功は意味的妥当性の証明ではない。"
  ]
}
