{
  "case_id": "TC10",
  "input": "新しい社内ツールで社員の満足度を大きく上げたい。\n満足度の測り方も現状値もまだないが、導入後は『成功した』と判定したい。\n対象の社員、評価時期、許容できるコストも決まっていない。\n",
  "goals": [
    {
      "id": "G1",
      "statement": "新しい社内ツールで社員満足度を大きく上げたい。",
      "status": "confirmed",
      "source": "cases/TC10.txt の明示記述"
    },
    {
      "id": "G2",
      "statement": "導入後に成功と判定したい。",
      "status": "confirmed",
      "source": "cases/TC10.txt の明示記述"
    },
    {
      "id": "GA",
      "statement": "社員の業務体験を改善し、その効果を説明したい可能性がある。",
      "status": "hypothesis",
      "source": "原文から推定した上位目的。依頼者未確認。"
    }
  ],
  "requirements": [
    {
      "id": "RP",
      "statement": "導入前に対象・測定方法・現状値・評価時期・費用と成功基準を合意する。",
      "status": "proposed",
      "kind": "business",
      "source": "分析者の提案。依頼者未承認。",
      "goal_ids": [
        "G1",
        "GA"
      ]
    }
  ],
  "hypotheses": [
    {
      "id": "H1",
      "statement": "ツールが日常の業務負担を減らせば満足度が上がるかもしれない。",
      "source": "分析者の原因・解決仮説。未検証。"
    },
    {
      "id": "H2",
      "statement": "対象によってツールの利便と負担が異なるかもしれない。",
      "source": "分析者の原因・解決仮説。未検証。"
    },
    {
      "id": "H3",
      "statement": "制度変更や導入期待、回答者の選択が満足度を左右するかもしれない。",
      "source": "分析者の原因・解決仮説。未検証。"
    }
  ],
  "unknowns": [
    {
      "id": "U1",
      "statement": "満足度の測り方・現状値・大きな改善の意味が未定",
      "impact": "成功と失敗を区別できない",
      "resolution": "目的に合う尺度を選び、導入前に測定と最小改善幅を合意する。"
    },
    {
      "id": "U2",
      "statement": "対象社員・評価時期・許容コストが未定",
      "impact": "評価範囲と投資判断を決められない",
      "resolution": "責任者と対象、時期、費用上限を合意する。"
    }
  ],
  "questions": [
    {
      "id": "Q1",
      "question": "誰のどの業務体験を改善したいですか？",
      "reason": "対象と満足度の測定内容を決める。",
      "priority": "high",
      "unknown_ids": [
        "U2"
      ]
    },
    {
      "id": "Q2",
      "question": "どの測定結果なら成功・不成功と判定しますか？",
      "reason": "事後の都合のよい判定を防ぐ基準を決める。",
      "priority": "high",
      "unknown_ids": [
        "U1"
      ]
    },
    {
      "id": "Q3",
      "question": "いつ評価し、どこまでの費用を許容しますか？",
      "reason": "評価時点と費用対効果の条件を決める。",
      "priority": "high",
      "unknown_ids": [
        "U2"
      ]
    }
  ],
  "verification": [
    {
      "id": "V1",
      "claim": "表明された目的・制約の充足性と、提案・原因仮説の妥当性を調べる。",
      "method": "導入前後に同じ尺度で対象者へ調査し、回答率と対象構成を記録する。可能なら比較群や段階導入で外部要因を検討する。",
      "metric": "合意した満足度尺度の変化、回答率、部署別の変化、業務負担、総費用。",
      "decision_rule": "成功基準は未確定。導入後に成功ありきで定めず、導入前に尺度・改善幅・時期・費用条件を合意する。",
      "limitation": "前後差だけでは因果効果を断定できず、未回答や期待効果による偏りがある。",
      "related_ids": [
        "G1",
        "G2",
        "GA",
        "RP",
        "H1",
        "H2",
        "H3"
      ],
      "status": "planned"
    }
  ],
  "risks": [
    {
      "id": "K1",
      "description": "成功を先に決め、悪化や否定的回答を除外してしまう。",
      "mitigation": "原因調査と関係者の合意を先に行い、基準を明示して試行結果を判断する。"
    }
  ],
  "warnings": [
    "成功したいという意向は実際の成功の証拠ではない。満足度の基準値や目標値を創作しない。",
    "業務検証は未実施。仮説の網羅性は保証しない。構造検証の成功は意味的妥当性の証明ではない。"
  ]
}
