{
  "case_id": "TC05",
  "input": "顧客情報を探すのに時間がかかる。ベクトルデータベースを入れて、AI検索にしてほしい。\n現状では顧客情報が複数の部署に分かれているが、検索の遅さの原因は調べていない。\n",
  "goals": [
    {
      "id": "G1",
      "statement": "顧客情報を探す時間を改善したい。",
      "status": "confirmed",
      "source": "cases/TC05.txt の明示記述"
    },
    {
      "id": "GA",
      "statement": "部署を越えて必要な顧客情報へ適切に到達したい可能性がある。",
      "status": "hypothesis",
      "source": "原文から推定した上位目的。依頼者未確認。"
    }
  ],
  "requirements": [
    {
      "id": "R1",
      "statement": "ベクトルデータベースを導入しAI検索にすることを希望している。",
      "status": "confirmed",
      "kind": "functional",
      "source": "cases/TC05.txt の明示記述",
      "goal_ids": [
        "G1"
      ]
    },
    {
      "id": "RP",
      "statement": "部署間の情報配置と権限を調べ、既存検索改善・統合索引・ベクトル検索を比較する。",
      "status": "proposed",
      "kind": "business",
      "source": "分析者の提案。依頼者未承認。",
      "goal_ids": [
        "G1",
        "GA"
      ]
    }
  ],
  "hypotheses": [
    {
      "id": "H1",
      "statement": "情報の分散とアクセス手続きが時間を要する原因かもしれない。",
      "source": "分析者の原因・解決仮説。未検証。"
    },
    {
      "id": "H2",
      "statement": "顧客IDや表記の不統一で照合が難しいかもしれない。",
      "source": "分析者の原因・解決仮説。未検証。"
    },
    {
      "id": "H3",
      "statement": "意味的な検索が必要な質問ならベクトル検索が役立つかもしれない。",
      "source": "分析者の原因・解決仮説。未検証。"
    },
    {
      "id": "H4",
      "statement": "現行検索の遅延やUI操作が主要因かもしれない。",
      "source": "分析者の原因・解決仮説。未検証。"
    }
  ],
  "unknowns": [
    {
      "id": "U1",
      "statement": "遅さの原因は未調査",
      "impact": "技術選択の妥当性を判断できない",
      "resolution": "検索作業の時間内訳とデータ所在を調査する。"
    },
    {
      "id": "U2",
      "statement": "顧客情報の利用権限と技術指定の変更可否",
      "impact": "横断検索の範囲と選択肢が定まらない",
      "resolution": "責任者と権限、指定技術を必須とする理由を確認する。"
    }
  ],
  "questions": [
    {
      "id": "Q1",
      "question": "実際の検索例と、どの作業で時間を使っているか教えてください。",
      "reason": "検索方式か情報統合かを優先判断する。",
      "priority": "high",
      "unknown_ids": [
        "U1"
      ]
    },
    {
      "id": "Q2",
      "question": "ベクトルDBは必須条件ですか、目的を満たせば別案も選べますか？",
      "reason": "比較可能な技術の範囲を決める。",
      "priority": "high",
      "unknown_ids": [
        "U2"
      ]
    },
    {
      "id": "Q3",
      "question": "部署を越えて誰にどの顧客情報の閲覧を許可しますか？",
      "reason": "検索範囲と権限設計を決める。",
      "priority": "high",
      "unknown_ids": [
        "U2"
      ]
    }
  ],
  "verification": [
    {
      "id": "V1",
      "claim": "表明された目的・制約の充足性と、提案・原因仮説の妥当性を調べる。",
      "method": "実検索を工程別に観察し、権限を維持した同じデータ・質問集合で複数方式を比較する。",
      "metric": "情報到達までの時間、関連結果の再現率・順位、権限外情報露出、運用費。",
      "decision_rule": "採用基準は未合意。原因調査と権限確認後に基準を合意し、指定技術だけを無条件採用しない。",
      "limitation": "関連性判定と質問集合に偏りがあり、ベクトル検索だけではデータ品質や部署間手続きを解決できない。",
      "related_ids": [
        "G1",
        "GA",
        "R1",
        "RP",
        "H1",
        "H2",
        "H3",
        "H4"
      ],
      "status": "planned"
    }
  ],
  "risks": [
    {
      "id": "K1",
      "description": "技術導入に投資しても主要な遅延原因が残る。",
      "mitigation": "原因調査と関係者の合意を先に行い、基準を明示して試行結果を判断する。"
    }
  ],
  "warnings": [
    "ベクトルDBは顧客が希望した手段であり、最適性は確認されていない。部署分散は事実だが原因とは未確定。",
    "業務検証は未実施。仮説の網羅性は保証しない。構造検証の成功は意味的妥当性の証明ではない。"
  ]
}
