{
  "case_id": "TC04",
  "input": "在庫管理を改善したい。今の管理方法や扱う品目、拠点数はまだ説明できない。\nどこが問題かも整理できていないので、まず何を調べるべきか知りたい。\n",
  "goals": [
    {
      "id": "G1",
      "statement": "在庫管理を改善したい。",
      "status": "confirmed",
      "source": "cases/TC04.txt の明示記述"
    },
    {
      "id": "G2",
      "statement": "まず何を調べるべきか知りたい。",
      "status": "confirmed",
      "source": "cases/TC04.txt の明示記述"
    },
    {
      "id": "GA",
      "statement": "在庫に関する判断や作業の負担を減らしたい可能性がある。",
      "status": "hypothesis",
      "source": "原文から推定した上位目的。依頼者未確認。"
    }
  ],
  "requirements": [
    {
      "id": "R1",
      "statement": "改善に先立つ調査項目を整理する。",
      "status": "confirmed",
      "kind": "business",
      "source": "cases/TC04.txt の明示記述",
      "goal_ids": [
        "G1",
        "G2"
      ]
    },
    {
      "id": "RP",
      "statement": "現行の入出庫・棚卸し・発注の流れと情報の流れを調査する。",
      "status": "proposed",
      "kind": "business",
      "source": "分析者の提案。依頼者未承認。",
      "goal_ids": [
        "G1",
        "GA"
      ]
    }
  ],
  "hypotheses": [
    {
      "id": "H1",
      "statement": "実在庫と記録の差が問題かもしれない。",
      "source": "分析者の原因・解決仮説。未検証。"
    },
    {
      "id": "H2",
      "statement": "欠品・滞留・過剰在庫が問題かもしれない。",
      "source": "分析者の原因・解決仮説。未検証。"
    },
    {
      "id": "H3",
      "statement": "二重入力、拠点間の連絡、責任分担が問題かもしれない。",
      "source": "分析者の原因・解決仮説。未検証。"
    }
  ],
  "unknowns": [
    {
      "id": "U1",
      "statement": "現行方法・品目・拠点数をまだ説明できない",
      "impact": "規模や調査範囲を定められない",
      "resolution": "台帳・手順書を確認し、関係者と一件の入出庫を追跡する。"
    },
    {
      "id": "U2",
      "statement": "問題と損失が未整理",
      "impact": "優先順位を決められない",
      "resolution": "困り事と例外事例を収集して影響を整理する。"
    }
  ],
  "questions": [
    {
      "id": "Q1",
      "question": "まず誰のどの在庫作業を一緒に確認できますか？",
      "reason": "初回観察の対象と協力者を決める。",
      "priority": "high",
      "unknown_ids": [
        "U1"
      ]
    },
    {
      "id": "Q2",
      "question": "最近困ったこと、やり直したことの例はありますか？",
      "reason": "調査する例外と影響を選ぶ。",
      "priority": "high",
      "unknown_ids": [
        "U2"
      ]
    }
  ],
  "verification": [
    {
      "id": "V1",
      "claim": "表明された目的・制約の充足性と、提案・原因仮説の妥当性を調べる。",
      "method": "既存資料と担当者の作業観察で現状図を作り、実物と台帳の照合、例外処理の追跡を行う。",
      "metric": "現行フローの把握範囲、未確認工程、在庫差異、手戻りや欠品事例の頻度・影響。",
      "decision_rule": "初期調査の終了条件と改善の合否基準は未確定。調査範囲を合意し、問題の存在を確かめてから設定する。",
      "limitation": "初回観察は季節変動や全拠点の例外を捉えない。列挙した問題が実在するとは限らない。",
      "related_ids": [
        "G1",
        "G2",
        "GA",
        "R1",
        "RP",
        "H1",
        "H2",
        "H3"
      ],
      "status": "planned"
    }
  ],
  "risks": [
    {
      "id": "K1",
      "description": "現状を知らずに在庫システムの導入を決める。",
      "mitigation": "原因調査と関係者の合意を先に行い、基準を明示して試行結果を判断する。"
    }
  ],
  "warnings": [
    "品目や拠点数が不明という事実を、単一拠点などの架空の条件で補わない。",
    "業務検証は未実施。仮説の網羅性は保証しない。構造検証の成功は意味的妥当性の証明ではない。"
  ]
}
