{
  "case_id": "TC02",
  "input": "問い合わせ窓口の対応を速くしたい。同時に誤回答も減らしたい。今の担当人数は増やせない。\n現状の対応時間や誤回答率は集計していない。\n",
  "goals": [
    {
      "id": "G1",
      "statement": "問い合わせ対応を速くしたい。",
      "status": "confirmed",
      "source": "cases/TC02.txt の明示記述"
    },
    {
      "id": "G2",
      "statement": "誤回答を減らしたい。",
      "status": "confirmed",
      "source": "cases/TC02.txt の明示記述"
    },
    {
      "id": "GA",
      "statement": "担当者と利用者双方の負担を抑えつつ、正しい解決を提供したい可能性がある。",
      "status": "hypothesis",
      "source": "原文から推定した上位目的。依頼者未確認。"
    }
  ],
  "requirements": [
    {
      "id": "R1",
      "statement": "担当人数を増やさない。",
      "status": "confirmed",
      "kind": "constraint",
      "source": "cases/TC02.txt の明示記述",
      "goal_ids": [
        "G1",
        "G2"
      ]
    },
    {
      "id": "RP",
      "statement": "対応速度と回答の正しさを同時に測り、問い合わせ種類別に改善を比較する。",
      "status": "proposed",
      "kind": "business",
      "source": "分析者の提案。依頼者未承認。",
      "goal_ids": [
        "G1",
        "GA"
      ]
    }
  ],
  "hypotheses": [
    {
      "id": "H1",
      "statement": "振り分けや引き継ぎの待ち時間が長いかもしれない。",
      "source": "分析者の原因・解決仮説。未検証。"
    },
    {
      "id": "H2",
      "statement": "回答資料の古さ・不足・分散が誤回答と遅延を生んでいるかもしれない。",
      "source": "分析者の原因・解決仮説。未検証。"
    },
    {
      "id": "H3",
      "statement": "案件の複雑さや繁忙の偏りが集計結果を左右するかもしれない。",
      "source": "分析者の原因・解決仮説。未検証。"
    }
  ],
  "unknowns": [
    {
      "id": "U1",
      "statement": "対応時間・誤回答率の現状値が未集計",
      "impact": "改善幅を評価できない",
      "resolution": "時間の起終点と誤回答の定義を合意し、既存記録を調査する。"
    },
    {
      "id": "U2",
      "statement": "速度と正確性の許容基準",
      "impact": "一方の悪化を許すか決められない",
      "resolution": "責任者と両指標の合否条件を合意する。"
    }
  ],
  "questions": [
    {
      "id": "Q1",
      "question": "対応時間の起終点と、誤回答の判定基準をどう定義しますか？",
      "reason": "同じ定義で現状と改善後を比較する。",
      "priority": "high",
      "unknown_ids": [
        "U1"
      ]
    },
    {
      "id": "Q2",
      "question": "速度と正確性が両立しない場合、どの悪化まで許容しますか？",
      "reason": "トレードオフ時の採否を決める。",
      "priority": "high",
      "unknown_ids": [
        "U2"
      ]
    }
  ],
  "verification": [
    {
      "id": "V1",
      "claim": "表明された目的・制約の充足性と、提案・原因仮説の妥当性を調べる。",
      "method": "既存の受付・回答記録を調査し、種類と繁忙度を揃えた試行を行う。回答は担当外の確認者が共通基準でレビューする。",
      "metric": "対応時間の中央値・上位分位、誤回答率、再問い合わせ率、担当者工数。",
      "decision_rule": "数値基準は未合意。人数据え置きを守り、速度と誤回答の両方の基準を事前に合意する。",
      "limitation": "案件構成や後から発覚する誤回答の影響が残る。工数削減が直ちに人数削減を意味するわけではない。",
      "related_ids": [
        "G1",
        "G2",
        "GA",
        "R1",
        "RP",
        "H1",
        "H2",
        "H3"
      ],
      "status": "planned"
    }
  ],
  "risks": [
    {
      "id": "K1",
      "description": "速度だけの最適化で回答品質が悪化する。",
      "mitigation": "原因調査と関係者の合意を先に行い、基準を明示して試行結果を判断する。"
    }
  ],
  "warnings": [
    "対応時間・誤回答率が未集計という点は原文の事実であり、現状性能の悪さの程度は不明。",
    "業務検証は未実施。仮説の網羅性は保証しない。構造検証の成功は意味的妥当性の証明ではない。"
  ]
}
