{
  "case_id": "TC03",
  "input": "社内ポータルを24時間365日、必ず利用できるようにしたい。\nただし運用費削減のため、唯一のサーバーは毎日23時から翌5時まで停止させる。\n代替サーバーやオフライン機能は設けない方針だ。\n",
  "goals": [
    {
      "id": "G1",
      "statement": "社内ポータルを24時間365日必ず利用可能にしたい。",
      "status": "confirmed",
      "source": "cases/TC03.txt の明示記述"
    },
    {
      "id": "G2",
      "statement": "運用費を削減したい。",
      "status": "confirmed",
      "source": "cases/TC03.txt の明示記述"
    },
    {
      "id": "GA",
      "statement": "必要なときの業務継続と費用抑制を両立したい可能性がある。",
      "status": "hypothesis",
      "source": "原文から推定した上位目的。依頼者未確認。"
    }
  ],
  "requirements": [
    {
      "id": "R1",
      "statement": "唯一のサーバーを毎日23時から翌5時まで停止する。",
      "status": "confirmed",
      "kind": "constraint",
      "source": "cases/TC03.txt の明示記述",
      "goal_ids": [
        "G1",
        "G2"
      ]
    },
    {
      "id": "R2",
      "statement": "代替サーバーもオフライン機能も設けない。",
      "status": "confirmed",
      "kind": "constraint",
      "source": "cases/TC03.txt の明示記述",
      "goal_ids": [
        "G1",
        "G2"
      ]
    },
    {
      "id": "R3",
      "statement": "24時間365日の利用可能性を求める。",
      "status": "confirmed",
      "kind": "non_functional",
      "source": "cases/TC03.txt の明示記述",
      "goal_ids": [
        "G1",
        "G2"
      ]
    },
    {
      "id": "RP",
      "statement": "可用性条件と停止方針のどちらを変更できるか決定してから設計する。",
      "status": "proposed",
      "kind": "business",
      "source": "分析者の提案。依頼者未承認。",
      "goal_ids": [
        "G1",
        "GA"
      ]
    }
  ],
  "hypotheses": [
    {
      "id": "H1",
      "statement": "夜間は実際には利用不要で、24時間という表現が過大かもしれない。",
      "source": "分析者の原因・解決仮説。未検証。"
    },
    {
      "id": "H2",
      "statement": "費用削減手段が停止だけに限定されている理由を見直せるかもしれない。",
      "source": "分析者の原因・解決仮説。未検証。"
    },
    {
      "id": "H3",
      "statement": "必ず利用可能という要求が復旧時間や業務継続の要求を指すかもしれない。",
      "source": "分析者の原因・解決仮説。未検証。"
    }
  ],
  "unknowns": [
    {
      "id": "U1",
      "statement": "矛盾する条件の変更権限と優先順位",
      "impact": "現状の条件では同時充足できない",
      "resolution": "依頼者と運用責任者に条件変更を判断してもらう。"
    },
    {
      "id": "U2",
      "statement": "利用可能の範囲・時間帯・保証条件",
      "impact": "受け入れ基準を作れない",
      "resolution": "業務上の利用場面と障害時の許容条件を明文化する。"
    }
  ],
  "questions": [
    {
      "id": "Q1",
      "question": "24時間利用、夜間停止、代替手段なしのどの条件を変更できますか？",
      "reason": "同時充足不能な仕様を解消する。",
      "priority": "high",
      "unknown_ids": [
        "U1"
      ]
    },
    {
      "id": "Q2",
      "question": "必ず利用可能とは、どの機能をどの状況でも利用できる意味ですか？",
      "reason": "可用性の定義と測定境界を決める。",
      "priority": "high",
      "unknown_ids": [
        "U2"
      ]
    }
  ],
  "verification": [
    {
      "id": "V1",
      "claim": "表明された目的・制約の充足性と、提案・原因仮説の妥当性を調べる。",
      "method": "唯一の提供サーバーが停止する時間帯の要求充足性を時系列表で検討し、責任者による条件レビューを行う。変更後は外部からの定期アクセス試験を計画する。",
      "metric": "停止時間帯の提供経路数、機能別利用可能時間、未解消の矛盾件数。",
      "decision_rule": "現在の条件は同時充足不可。条件変更が合意されるまで設計の承認を保留。変更後の可用性基準は未確定。",
      "limitation": "論理的な矛盾の指摘は稼働試験ではない。有限期間の試験では永続的な無停止を保証できない。",
      "related_ids": [
        "G1",
        "G2",
        "GA",
        "R1",
        "R2",
        "R3",
        "RP",
        "H1",
        "H2",
        "H3"
      ],
      "status": "planned"
    }
  ],
  "risks": [
    {
      "id": "K1",
      "description": "矛盾を隠して稼働保証を約束してしまう。",
      "mitigation": "原因調査と関係者の合意を先に行い、基準を明示して試行結果を判断する。"
    }
  ],
  "warnings": [
    "夜間停止と唯一の提供経路という明示条件は、24時間利用要求と衝突する。動作検証は未実施。",
    "業務検証は未実施。仮説の網羅性は保証しない。構造検証の成功は意味的妥当性の証明ではない。"
  ]
}
